Nom,Type de rhum,Type de rhum précision,Degré d'alcool,Brasserie,Pays,Prix,Epicé/Boisé,Tourbé/Fumé,Fruité,Floral/Végétal,Vivacité,Sucrosité,Pâtissier,Visuel,Odeur,Goût,Ancienneté,Description,Url
"BARCELO ORGANIC 37,5%",AMBRÉ,RON - TRADITION ESPAGNOLE,37.5,BARCELÓ & CO,RÉPUBLIQUE DOMINICAINE,34.9,10,0,8,4,4,4,8,Ambre Intense,"Fruits Confits, Cerise Caramélisé, Fruits Secs, Cacao Tabac, Poivre, Boisé","Riche, Rond, Fruits Exotiques, Mangue, Ananas, Vanille, Réglisse, Menthe",2,"Ancré depuis près de 100 ans dans l'histoire de la République Dominicaine, Barcelo ouvre aujourd'hui un nouveau chapitre pour l'ensemble des rhums hispaniques : la sortie du premier rhum Bio !
Cette nouvelle référence s'inscrit dans un important projet débuté il y a 5 ans. En effet, la distillerie Barcelo a lancé la création d'une plateforme qui intègre l'ensemble du processus de production avec pour objectif de réduire l'impact sur l'environnement. Aujourd'hui cette plateforme assure à Barcelo une activité neutre en carbone. Ils compensent également le reste des émissions par une implication dans divers projets environnementaux à travers le monde.
Ainsi, c'est en 2016 que 150 hectares des plus anciens champs de cannes à sucre de l'île débutent leur réhabilitation, afin d'effacer toutes traces d'engrais. Ces champs sont proches de la distillerie afin de limiter le transport, mais aussi proche d'une rivière afin de profiter de l'irrigation et de la fertilisation naturelle des sols.
Lors de la fermentation, des levures biologiques sont utilisées avant que les jus soient distillés et mis à vieillir entre 2 et5 ans dans des fûts de chêne américain neufs afin de suivre strictement les standards biologiques.
Cette démarche se développe jusque dans l'emballage, crée à base de fibres végétales de canne à sucre et d'encre végétale. Un évènement pour le monde du rhum !
Avec un emballage V and B 100 % recyclable, vous avez ici un produit éco-responsable de la tête au pied.",https://vandb.fr/barcelo-organic-37-5-.html
J.M. 6 ANS XO 45%,AMBRÉ,RHUM - TRADITION FRANÇAISE,46.0,J.M.,MARTINIQUE,69.9,8,0,8,0,6,2,0,Or Brillant,"Intense, Suave, Fruits Exotiques, Epicés","Poivre Noir, Muscade, Bonbon Acidulé, Chaleureux, Fruits Exotiques",6,"Nul amateur de rhum ne peut ignorer la superbe de J.M. Située proche de la Montagne Pelée, la Maison J.M s'est construit une identitée de producteur iconique de la Martinique.
Nichée entre deux rivières, la Maison peut profiter d'un cadre idéal pour la production de rhum avec une franche identité. Le sol volcanique qui facilite la culture de la canne, un soleil abondant et une humidité idéale.
De parfaites conditions pour faire de grands rhums. La preuve avec avec ce rhum XO 6 ans Cet embouteillage est issu de l'assemblage de rhums vieilli en fûts de Bourbon. On obtient ainsi un jus chaleureux, fin et complexe. Entre fruits exotiques et épices. Un grand rhum !
A découvrir chez V and B",https://vandb.fr/j-m-6-ans-xo-45-.html
DIPLOMATICO SINGLE VINTAGE 2005 43%,AMBRÉ,RON - TRADITION ESPAGNOLE,43.0,DESTILERÍAS UNIDAS,VENEZUELA,98.0,10,0,6,0,0,8,8,Brun Sherry,"Vanille, café, chocolat","Fruits secs, bois, fumée",12,"Diplomatico, le plus célèbre des rhums du Vénézuéla nous offre sa version millésimée ! Après le 2004, le 2005 avec toujours la même finesse et gourmandise !
Pourquoi millésimer un rhum ? Pour saisir toute la dimension de l'année embouteillée, de sa récolte et surtout de sa distillation.
Ainsi, après une distillation en colonnes en 2005, le rhum a profité de 12 longues années de vieillissement en fûts de bourbon avant de reposer une année supplémentaire en fûts de sherry.
Tout ce processus se déroule sous la houlette du maître rhumier de la distillerie, Tito Cordero, le champion du monde 2014 de sa catégorie !
Et que dire du résultat. Un rhum conjugué au plus que parfait, à la hauteur des attentes, gourmand et riche, aux épices chaleureuses et à la complexité sublimes. Joliment embouteillé dans une carafe très élégante.
À découvrir sur VandB.fr",https://vandb.fr/diplomatico-single-vintage-2005-43-.html
J.M VSOP 43%,AMBRÉ,RHUM - TRADITION FRANÇAISE,43.0,J.M,FRANCE,47.9,8,0,10,4,6,0,2,Or jaune,"Fruits blancs, agrumes, café, canne fraiche","Epices douces, réglisse, chocolat, figue",4,"Depuis plusieurs décennies, les rhums vieux J.M. sont considérés comme certains des meilleurs au monde. Malgré quelques changements de propriétaires, la distillerie a su garder son héritage et son identité artisanale. Située au nord de la Martinique, sur la Montagne Pelé, la distillerie profite d'un parfait climat tropical, humide, mais aussi d'une terre de roche volcanique. Un endroit idyllique pour la culture de la canne à sucre.
Cette référence est l'une des entrées phares de la distillerie. La canne à sucre fraiche est sélectionnée avec soin, broyée et distillée dans deux alambics traditionnels à 72%. Un degré de distillation relativement bas, qui garantit l'aromatique des cannes à sucre fraiche. De quoi avoir une explosion d'arômes végétaux et herbacés avec d'être mis à reposé en fûts. Son vieillissement dans d'anciens fûts de bourbon rebrulés lui offre une complexité rare pour un rhum agricole.",https://vandb.fr/j-m-vsop-43-.html
ZACAPA EDICION NEGRA 43%,AMBRÉ,RON - TRADITION ESPAGNOLE,43.0,ILG,GUATEMALA,69.9,0,6,8,0,0,6,4,Acajou,"Fumée, chocolat, fruits secs","Fumée, fruits cuits, raisins secs, cacao",0,"Savez-vous comment la maison Zacapa confectionne ses rons ? D'abord, la mélasse est mise à fermenter avec des levures provenant d'ananas locaux, pour ensuite être distillé dans un alambic à colonne unique. Vient ensuite le vieillissement selon la méthode solera, dans un chai perché à 2300 mètres d'altitude, dans des fûts de plusieurs types ayant anciennement contenu du bourbon, du xérès, ou encore du porto.
Pour ce Zacapa Edicion Negra, la Master Blender Lorena Vasquez a eu l'idée de passer le ron dans des fûts ex-bourbon ayant été fortement chauffés afin de développer de nouveaux arômes.
Le nez évoque des notes de cacao et de fruits caramélisés auxquelles se mêlent des notes délicatement fumées.
La bouche confirme les perceptions du nez, avec des arômes de fruits secs et de cacao rehaussées de notes fumées.
La finale est persistante sur cette même trame.
Avec son profil résolument fumé et pâtissier, ce Zacapa Edition negra accompagnera idéalement vos fins de repas.",https://vandb.fr/zacapa-edicion-negra-43-.html
BUMBU SPICED 40%,AMBRÉ,SPICED,40.0,THE WEST INDIES RUM DISTILLERY,BARBADE,37.9,6,0,6,0,2,8,8,"Ambré, marron","Fruits tropicaux, vanille","Vanille, cannelle, noix grillées, piment",0,"Bumbu est produit de manière artisanale sur l'île de la Barbade, dans la distillerie ""The West Indies Rum Company"" fondée en 1893 ! Élaboré en respectant la recette traditionnelle des premiers rhums épicés des Caraïbes, il est assemblé à partir de canne à sucre en provenance de 8 pays différents : Barbade, Brésil, Costa Rica, République Dominicaine, Salvador, Guyane et Honduras !
Distillé dans deux alambics continus, il est ensuite reposé 15 ans en fûts de bourbon du Kentucky. Les levures utilisées lors de la fermentation sont quant à elles gardées secrètes depuis 1840.
La bouteille, de son côté, ne possède pas d'étiquette papier mais est ornée d'une croix en métal à l'avant et d'une carte des Caraïbes au dos. Son massif bouchon de liège brut laisse échapper un ""POP"" franc à chaque ouverture. Une édition définitivement PIRATES !",https://vandb.fr/bumbu-spiced-40-.html
BALLY 7 ANS 45%,AMBRÉ,RHUM - TRADITION FRANÇAISE,45.0,BALLY,MARTINIQUE,55.9,10,0,8,10,8,4,6,Ambre Profond,"Riche, Puissant, Fruits Secs, Bois Fin, Miel, Épices, Fruits Confits, Cire","Corsé, Ample, Noix, Noisettes grillées, Épices, Jus de Canne Frais, Réglisse, Fruits Secs, Boisée, Sirop de Canne",7,"C'est en 1917 que Jacques Bally fonde la Maison J.Bally. Depuis, la distillerie martiniquaise a construit sa renommée et a su acquérir une place spéciale dans le cœur des amateurs de rhum.
Le Rhum ambré Bally 7 ans est la rencontre entre la version 3 ans, son corps vif et corsé, ces épices douces, ses fruits cuits, et le 12 ans, avec son bois précieux, ses épices chaudes, ses notes empyreumatiques. Il est le parfait équilibre entre ces deux profils tout en profitant de cette touche gourmande caractéristique de ces rhums martiniquais. Une précision et une richesse propre à la Maison Bally.
Le petit plus, sa carafe de forme pyramidale iconique, dessiné pour la première fois dans les années 30 ! Plus aucun doute, ce rhum agricole est unique et ravira les amateurs comme les néophytes désireux de passer au niveau supérieur !",https://vandb.fr/bally-7-ans-45-.html
"LA FAVORITE CUVÉE PRIVILÈGE POUR LULU BATCH 2 41,3%",AMBRÉ,RHUM - TRADITION FRANÇAISE,41.3,LA FAVORITE,MARTINIQUE,153.0,8,0,8,8,2,2,8,Ambré,"Fruité, Banane, Floral, Fleurs Blanches, Végétal, Boisé, Riche","Onctueuse, Riche, Gourmande, Boisée, Épicée, Vanillé, Miellé",10,"La Cuvée Privilège pour Lulu est une de ces références d'exception, qui touche chaque amateur de rhum. Assemblage des millésimes 1998, 2000, 2001, 2002 et 2008, limitée à 4 500 bouteilles... C'est une référence exceptionnelle. L'équilibre est incroyable, fruit de la rencontre entre les différents profils aromatiques de chaque millésime. On voyage ainsi entre la gourmandise, l'onctuosité, le boisé, le miellé et le fruité. Une complexité infinie qui vous fera voyager à coup sûr à travers les champs de canne à sucre, avant de rejoindre les chais de la distillerie,
La distillerie de la famille Dormoy de La Favorite est un emblème des rhums agricoles français. Chaque nouvelle sortie de la Maison est un évènement incontournable. Durant plus d'un siècle et demi, l'une des maisons indépendantes de la Martinique a su développer son image, basée sur une qualité exceptionnelle.
Tous les amateurs de rhums connaissent La Favorite. Son nom provient de l'époque de Napoléon, ce dernier aurait proclamé ""cette liqueur sera ma favorite"" en dégustant ce rhum des Antilles. Et on le comprend !",https://vandb.fr/la-favorite-cuvee-privilege-pour-lulu-batch-2-41-3-.html
"LA FAVORITE RESERVE DU CHÂTEAU 2002 41,2%",AMBRÉ,RHUM - TRADITION FRANÇAISE,41.2,LA FAVORITE,MARTINIQUE,247.0,10,0,4,10,8,2,6,"Cuivre, Roux","Vive, Complexe, Gourmande, Épices, Réglisse, Poivre, Boisé, Cuivre, Végétal","Complexe, Frais, Sec, Poivre, Boisé, Végétal, Réglisse",18,"La Reserve du Château est une référence particulière. Sublimée dans une carafe à la forme étonnante, elle renferme un jus d'une infinie complexité. Après avoir suivi le processus traditionnel de la distillerie : cannes à sucre locales des 60 hectares possédés par la maison, fermentation avec des levures de boulangerie, distillation en colonne créole... le distillat a reçu un traitement particulier. C'est un vieillissement de douze années qui a permit à ce rhum de développer des arômes très épicés, avec un boisé d'une belle structure, mais une finesse incroyable, De longs arômes de fruits secs se dévoilent, faisant ainsi de cette Reserve du Château un excellent digestif que vous apprécierez après un bon repas.
La distillerie de la famille Dormoy de La Favorite est un emblème des rhums agricoles français. Chaque nouvelle sortie de la Maison est un évènement incontournable. Durant plus d'un siècle et demi, l'une des maisons indépendantes de la Martinique a su développer son image, basée sur une qualité exceptionnelle.
Tous les amateurs de rhums connaissent La Favorite. Son nom provient de l'époque de Napoléon, ce dernier saurait proclamé ""cette liqueur sera ma favorite"" en dégustant ce rhum des Antilles. Et on le comprend !",https://vandb.fr/la-favorite-reserve-du-chateau-2002-41-2-.html
"LA FAVORITE 2011 49,7%",AMBRÉ,RHUM - TRADITION FRANÇAISE,49.7,LA FAVORITE,MARTINIQUE,95.0,10,0,10,6,6,0,0,Ambré,"Boisé, vanillé, poivre, végétal","Fruits exotiques, épices, canne, fruits rouges",8,"Chaque nouveau millésime sortant des chais de La Favorite est un évènement pour tous les amateurs. Après un vieillissement de 8 ans en fûts de Cognac, ce rhum est embouteillé à la force du fût lui permettant de conserver l'ensemble des qualités organoleptiques. A la dégustation, on découvre des notes très épicées et boisées de fruits confits et mûrs comme le pruneaux. Le cognac apporte de la rondeur et de la gourmandise, mais aussi des notes tanniques. Un millésime superbe, extrêmement complexe à déguster en toute sagesse. Tous les amateurs de rhums connaissent La Favorite. Son nom provient de l'époque de Napoléon, ce dernier aurait proclamé ""cette liqueur sera ma favorite"" en dégustant ce rhum des Antilles. Et on le comprend !
Aujourd'hui, les rhums de la distillerie sont produits à partir de cannes à sucre provenant des 60 hectares qu'elle possède, mais aussi de petits producteurs aux alentours. L'énergie provient d'une machine à vapeur datant de 1900 qui assure ainsi le fonctionnement complet de l'ensemble de l'exploitation. Pour la fermentation, des levures de boulangeries sont utilisées. Elles confèrent les arômes si gourmands de la gamme La Favorite. Pour la distillation, deux colonnes créoles distillent les précieux rhums.
Cette cuvée particulière est le symbole de la rencontre entre la tradition ancestrale et le souhait de se démarquer des autres maisons martiniquaises. Après avoir suivi le processus traditionnel, les jus distillés ont rempli des fûts de chênes ayant précédemment contenu du Cognac. C'est ainsi que les arômes de pâtisserie, de crème, de prune et d'épices sont exacerbés.
Une expérience à vivre au moins une fois !",https://vandb.fr/la-favorite-2011-49-7-.html
BALLY 3 ANS 45%,AMBRÉ,RHUM - TRADITION FRANÇAISE,45.0,BALLY,MARTINIQUE,45.0,10,0,10,6,8,4,6,"Ambré, Cuivré","Intense, Vanillé, Boisé, Fruits Secs, Fruits Confits, Dattes, Figues","Vive, Généreuse, Fruitée, Fraiche, Agrumes, Vanille, Épices douces, Boisée",3,"C'est en 1917 que Jacques Bally fonde la Maison J.Bally. Dès les premiers jours de la distillerie, il eut le génie de faire vieillir les distillats en fûts, comme pouvait le faire les autres grands alcools français. Depuis, la Maison Bally a su se développer et acquérir une place spéciale dans le cœur des amateurs de rhum.
Ce rhum ambré de 3 ans est un retour aux sources pour la Maison, Le jus est tout aussi exceptionnel et parfaitement mis en valeur par cette sublime carafe pyramidale dessinée la première fois dans les années 30.
On ressent toute l'importance du vieillissement. Ce rhum ambré de 3 ans est d'une rare finesse, à la complexité inégalée. Se rencontrent le bois précieux, les fruits secs et confits, les notes vanillées, de cuir et de tabac... Une dégustation exceptionnelle, équilibrée, qui vous ravira à coup sûr !",https://vandb.fr/bally-3-ans-45-.html
LA FAVORITE RIVIÈRE BEL'AIR 2019 53%,BLANC,RHUM - TRADITION FRANÇAISE,53.0,LA FAVORITE,MARTINIQUE,49.9,0,0,10,8,6,4,0,Cristallin,"canne à sucre, agrumes, fleur blanche","Fruits exotiques, canne fraîche. fruitée, sucre doux.",0,"Cette cuvée Rivière Bel'Air est produite à partir d'une seule variété de canne rouge (B64.277) cultivée sur 3 petits hectares attenant à la distillerie.
La distillerie emblématique de Martinique nous offre une fois encore un embouteillage monovariétal sublime.
le processus traditionnel est maitrisé à la perfection : longue fermentation, distillation en continue et réduction lente. Le tout mise en route par la même machine à vapeur depuis plus de 100 ans ! De quoi obtenir un distillat d'une grande fraicheur, avec des notes de canne pure, légèrement sucré et très fruité.
Une magnifique réalisation qui se suffit à elle-même, ou accompagné d'un zest de citron vert.",https://vandb.fr/la-favorite-riviere-bel-air-2019-53-.html
CARONI TRINIDAD 22 ANS 1998 BALAS BHAGGAN EMPLOYEES 4TH REL.,AMBRÉ,RUM - TRADITION ANGLAISE,68.4,CARONI,TRINITÉ ET TOBAGO,395.0,4,8,8,6,2,0,6,Acajou,"Agrumes, chocolat, orange amère, pamplemousse, épices","Tabac, boisé, hydrocarbures",22,"Cet embouteillage fait partie de la quatrième édition de la collection Employees, qui rend hommage aux employés qui ont travaillé à la distillerie. A l'honneur ici, Balas Bhaggan, qui travailla durant 14 ans à la distillerie et qui œuvra pour son développement.
Ce 22 ans, distillé en 1998, est un assemblage de 6 fûts vieilli exclusivement à Trinidad.
Un joyau qui sublimera votre collection de rhums !
L'histoire de Caroni est tout aussi exceptionnelle que les distillats qu'elle continue de nous offrir malgré sa fermeture. Fondée en 1918, Caroni était la distillerie d'état de Trinidad, mais aussi la plus grande sucrière du pays. Durant 84 ans, la distillerie a tourné à plein régime, profitant de ses alambics à colonne et à repasse pour produire des ""Heavy Rums"", une catégorie de rhums au style particulier car lourd en particules aromatiques. En 2002, sur décision de l'État, la distillerie ferme ses portes. Quelques années plus tard, la Maison Vellier et La Maison du Whisky s'allient pour le rachat de plusieurs centaines de fûts restants. Depuis, les embouteillages sont en édition limitée et rencontrent un succès fous, aussi bien auprès des amateurs que des collectionneurs.",https://vandb.fr/caroni-trinidad-22-ans-1998-balas-bhaggan-employees-4th-rel-.html
CARONI TRINIDAD 20 ANS 2000 BASDEO RAMSARRAN EMPLOYEES 4TH REL.,AMBRÉ,RUM - TRADITION ANGLAISE,64.3,CARONI,TRINITÉ ET TOBAGO,385.0,6,10,8,4,2,0,4,Brun,"Hydrocarbures, cacao, fruits mûrs, floral","Hydrocarbures, cacao, végétal, médicinal, camphre, fruité, épicé",20,"L'histoire de Caroni est tout aussi exceptionnelle que les distillats qu'elle continue de nous offrir malgré sa fermeture. Fondée en 1918, Caroni était la distillerie d'état de Trinidad, mais aussi la plus grande sucrière du pays. Durant 84 ans, la distillerie a tourné à plein régime, profitant de ses alambics à colonne et à repasse pour produire des ""Heavy Rums"", une catégorie de rhums au style particulier car lourd en particules aromatiques. En 2002, sur décision de l'État, la distillerie ferme ses portes. Quelques années plus tard, la Maison Vellier et La Maison du Whisky s'allient pour le rachat de plusieurs centaines de fûts restants. Depuis, les embouteillages sont en édition limitée et rencontrent un succès fous, aussi bien auprès des amateurs que des collectionneurs.
Cet embouteillage fait partie de la quatrième édition de la collection Employees, qui rend hommages aux employés qui ont travaillé à la distillerie. Sur ce 20 ans du millésime 2000, c'est Badeo Ramsarran et ses 20 ans d'ancienneté qui sont mis à l'honneur.
Assemblage de 6 fûts différents, cet embouteillage est assurément un Caroni avec ces notes d'hydrocarbures emblématiques !
Un joyau qui sublimera votre collection de rhums !",https://vandb.fr/caroni-trinidad-20-ans-2000-basdeo-ramsarran-employees-4th-rel-.html
CARONI TRINIDAD 22 ANS 1998 DAYANAND BALLOON EMPLOYEES 4TH R,AMBRÉ,RUM - TRADITION ANGLAISE,68.3,CARONI,TRINITÉ ET TOBAGO,395.0,6,8,10,8,4,0,0,Acajou,"Agrumes, noix","Fruits exotiques, floral, hydrocarbures",22,"Une fois encore, Caroni rend un magnifique hommage aux hommes et femmes qui ont fait la distillerie durant plus de 8 décennies d'existence. Cette fois-ci, Dayanad Balloon est à l'honneur, une manière de le remercier pour ses 10 années de travail acharné chez Caroni.
Sélectionné par Luca Gargano lui-même, accompagné de passionnés, cet embouteillage prouve une fois encore l'unicité de la distillerie, tel un joyaux des Caraïbes, qui vous assure un instant de dégustation intense et inoubliable.
L'histoire de Caroni est tout aussi exceptionnelle que les distillats qu'elle continue de nous offrir malgré sa fermeture. Fondée en 1918, Caroni était la distillerie d'état de Trinidad, mais aussi la plus grande sucrière du pays. Durant 84 ans, la distillerie a tourné à plein régime, profitant de ses alambics à colonne et à repasse pour produire des ""Heavy Rums"", une catégorie de rhums au style particulier car lourd en particules aromatiques. En 2002, sur décision de l'État, la distillerie ferme ses portes. Quelques années plus tard, la Maison Vellier et La Maison du Whisky s'allient pour le rachat de plusieurs centaines de fûts restants. Depuis, les embouteillages sont en édition limitée et rencontrent un succès fous, aussi bien auprès des amateurs que des collectionneurs.
Un diamant brut qui sublimera votre collection de rhums !",https://vandb.fr/caroni-trinidad-22-ans-1998-dayanand-balloon-employees-4th-r.html
DON PAPA RYE CASK 45%,AMBRÉ,RON - TRADITION ESPAGNOLE,45.0,BAGO,PHILIPPINES,75.0,8,0,6,0,0,6,6,Jaune doré,"Epices, seigle, caramel salé, fruits","Céréales, épices, pruneaux, seigle, chocolat noir",4,"Cette innovation de Don Papa est assez unique dans les paysages des rhums.
La célèbre signature des Philippines est reconnu pour sa gourmandise opulente. Avec cette édition, Don Papa sort des sentiers battus, et profite d'un long affinage de 4 ans dans fûts ayant contenu des whiskeys de Rye du Tennessee aux USA.
Et c'est une belle surprise ! La gourmandise est toujours là, mais celle-ci est enrobée d'une touche céréale délicate. Un bel équilibre se ressent entre les saveurs de seigle croquantes, et les notes plus épicées rappelant le chocolat, les pruneaux et le miel. Un joli boisé affine le tout.
Ce Don Papa est rare et unique, et saura vous transporter vers de nouveaux horizons ! Une belle réussite !",https://vandb.fr/don-papa-rye-cask-45-.html
"CLAIRIN COMMUNAL ANSYEN 49,30%",AMBRÉ,RHUM - TRADITION FRANÇAISE,49.3,MULTIPLES,HAÏTI,53.0,2,6,10,8,4,2,4,Topaze,"Empyreumatique, fraise, floral","Médicinal, réglisse, menthe, banane",1,"Ce Clairin Communal Ansyen est un rhum à part entière. Développé par la maison Vellier, reconnue pour ces embouteillages d'exceptions, cet Ansyen est un assemblage de quatre clairins, style haïtien traditionnel : Sajou, Vaval, Casimir et Le Rocher.
Au delà de cette rencontre exceptionnelle, les jus ont profité d'un vieillissement double, d'abord en fûts de rhums (Bielle, Caroni, Mount Gay…), puis en fûts ayant contenu du whiskies, aussi bien Écossais qu'Américains (Benriach, Widow Jane, Buffalo Trace, Jack Daniel’s…).
On obtient ainsi un rhum unique à la palette aromatique très étendue, parcourant tous les styles : floraux, fruités, épicés, empyreumatiques, herbacés et miellés... Une très jolie dégustation, somme de l'ensemble des éléments qui le constituent, des jus aux fûts !",https://vandb.fr/clairin-communal-ansyen-49-30-.html
PROVIDENCE 57%,BLANC,RHUM - TRADITION FRANÇAISE,57.0,DISTILLERIE DE PORT AU PRINCE,HAÏTI,43.0,4,0,10,8,8,4,0,Cristallin,"Canne fraîche, fruits blancs et exotiques, gingembre","Canne fraîche, jus de poire, minéral, abricot, crémeux",0,"Produit par la Distillerie de Port-au-Prince, dans la ville du même nom à Haïti, cet embouteillage unique présente les premières gouttes de distillat qui sortent de l'alambic de la distillerie. Un long projet orchestré par Luca Gargano, de la Maison Vellier, les héritiers de la famille Barbancourt et son compère Gianni Capovilla.
Il est issu de l'assemblage de pur jus et de sirop de canne Cristalline. Après une fermentation lente, et une distillation en alambic à repasse Muller en Novembre 2019, on obtient un rhum riche, vif, extrêmement aromatique (538,9 g/hlp de composées aromatiques !).
Et nous, on adore ce genre de rencontre ! Foncez, il n'y en aura par pour tout le monde !",https://vandb.fr/providence-57-.html
"PLANTATION BARBADOS 2011 51,1%",AMBRÉ,RUM - TRADITION ANGLAISE,51.1,WIRD,BARBADE,59.0,8,0,10,2,6,0,6,Or Profond,"Boisé, épicé, raisins, prune, agrumes, amandes","Raisins, noix, chocolat, caramel, vanille, muscade, floral, agrumes",9,"Plantation continue de nous proposer des millésimes exceptionnels avec cette fois une sélection de 24 fûts cachés des chais de la distillerie West Indies.
Ce rhum a des caractéristiques uniques : Les jus sont un assemblage de deux styles d'alambic : une distillation en colonne, et une distillation en deux temps dans le fameux alambic Gregg's Farm. Par la suite, les jus distillés ont vieillis durant 4 ans et demi sous un climat tropical, accentuant l'échange avec le bois, avant de profiter d'une seconde maturation continentale, dans les chais du Château de Bonbonnet, dans des fûts de Cognac Ferrand.
On obtient ainsi un rhum ambré boisé, aux notes complexes et empyreumatiques, de chocolat croquant, d'épices chaleureuses, le tout est d'une rare gourmandise.",https://vandb.fr/plantation-barbados-2011-51-1-.html
