ABUELO 12 ANS 40%,AMBRÉ,RON - TRADITION ESPAGNOLE,40.0,DON JOSE,PANAMA,49.9,8,0,6,0,2,6,6,Cuivre profond,"Caramel, chêne toasté, tabac, épices, agrumes, fruits à coque","Caramel, épices, boisé",12,"L'histoire peut dire merci à Don José Varela Blanco, jeune immigrant espagnol, d'avoir créé la première sucrerie au Panama en 1908, puis à ses trois fils arrivèrent à convaincre le patriarche de démarrer la distillation en 1936 de la canne. Cela donnera naissance à la seule distillerie encore en activité sur l'Île aujourd'hui.
Un siècle plus tard, Abuelo 12 ans vient compléter la gamme avec 5 ans de vieillissement supplémentaire par rapport à son petit frère. Ces années supplémentaires vont apporter des notes boisées plus marquées à la dégustation.
Le nez généreux exalte des notes boisées, caramélisées, du tabac, de l'orange amer, des épices et des fruits à coque. La bouche confirme cette richesse et nous entraîne dans une longue et douce finale pâtissière.",https://vandb.fr/abuelo-12-ans-40-.html
LONGUETEAU 3 ANS 42%,AMBRÉ,RHUM - TRADITION FRANÇAISE,42.0,LONGUETEAU,FRANCE,42.9,10,0,0,0,6,0,0,Vieil or,"Muscade, cannelle","Notes boisées, vanille",3,"La distillerie Longueteau est la seule de Guadeloupe à cultiver elle-même la totalité des cannes à sucre nécessaires à l'élaboration de ses rhums. Si Longueteau s'est fait d'abord connaître pour la qualité de ses rhums agricoles, la maison a aussi acquis une forte notoriété grâce à la qualité de ses punchs.
Ce rhum vieux agricole est issu du Domaine du Marquisat de Sainte-Marie, fief de la Maison Longueteau où se situe sa distillerie.
Son vieillissement de trois en fût de chêne français ex-cognac lui donne droit à l’appellation de rhum vieux. C'est grâce à cette maturation que ce rhum va développer des arômes délicats d'épices douces.
Au nez, les notes de cannelle et de muscade se dégagent.
La bouche s'ouvre sur des arômes boisés subtilement amenés qui s'allient à de douces notes vanillées.
La finale nous laisse sur les notes épices douces.",https://vandb.fr/longueteau-3-ans-42-.html
FERRONI BOUCAN D'ENFER 50%,AMBRÉ,RUM - TRADITION ANGLAISE,50.0,BLEND,FRANCE,45.0,2,8,10,0,2,0,6,Cuivre profond,"Feu de tourbe, fruité, poires, pêches, fruits exotiques, mélasse, viande fumée","Vanille, fruits cuits, fumé, iodé, poivre, mélasse",0,"La Maison Ferroni n'a vu le jour que très récemment, en 2011, dans la ville de Marseille. En peu de temps, elle s'est lancée dans plusieurs aventures et s'est rapidement fait connaitre et reconnaître pour chacune d'elles : vieillissement, embouteillage et assemblage de rhum et de whisky, élaboration de gin, fabrication de liqueurs et distillation de pastis millésimés.
C'est au sein de l'activité ""rhumière"" de Ferroni que ce Boucan d'Enfer a vu le jour.
Il est le fruit d'un assemblage de rhums élaborés à base de mélasse (Guyana, Trinidad), de rhums issus de pur jus de canne (Île Maurice), et d'un rhum martiniquais ""grand arôme"". Tout ce joli petit monde, une fois assemblé, est mis à maturer dans les chais à Marseille. D'abord 12 mois dans d'anciens fûts de cognac, puis 6 mois dans d'anciens fûts de rasteau et enfin quelques semaines dans d'anciens fût de whisky tourbé d'Islay.
Un rhum complexe, du nez à la bouche, où se mêlent avec brio les arômes fruités et fumés. Osez la découverte !",https://vandb.fr/ferroni-boucan-d-enfer-50-.html
TI CED ARRANGÉ MANGUE PASSION 32%,AMBRÉ,ARRANGÉS,32.0,AUCUNE,FRANCE,18.9,0,0,10,4,6,6,0,Teinte jaune clair ou sur des variantes de rose,"Mangue fraîche juteuse, fruit de la passion, vanille","Mangue confiturée, fruit de la passion frais, finale fleurs séchées (rose)",0,"Les rhums arrangés Ti'Ced sont aujourd'hui une grande famille. Leur créateur, Cédric Brément, continue de découvrir de nouvelles associations de saveurs qu'il ne manque pas de nous faire partager.
Découvrez ici un classique et ""best-seller"" de la gamme des arrangés de Ced qui joue à 100% la carte de l'exotisme ! Du soleil, du soleil et encore de soleil pour cette association Mangue Passion.
La gourmandise de la mangue compotée se comporte à merveille avec les notes acidulées apportées par le fruit de la passion. Un combo classique et efficace qui ravira aussi bien un public masculin que féminin.",https://vandb.fr/158109/ti-ced-arrange-mangue-passion-32-.html
TI CED ARRANGÉ POMME POIRE BIO 21 %,PAILLE,ARRANGÉS,21.0,AUCUNE,FRANCE,22.0,0,0,10,0,2,6,6,"Jaune pâle, reflets dorés","Pomme « façon tatin », clafoutis poire","Moelleuse, sucrée, eaux de vie poire, Calvados",0,"Chez Ti Ced, on connait l'importance du respect du terroir et de l'environnement permettant d'obtenir des fruits de qualité, essentiels à l'élaboration de rhums arrangés. C'est pourquoi il valorise ici l'agriculture biologique en utilisant des pommes et des poires certifiées BIO. Mais Ced ne s'arrête pas là, le rhum ainsi que le sirop de sucre de canne sélectionnés sont également BIO.
La gourmandise est de mise avec ce combo pomme poire ! Au nez, des notes de tarte Tatin et de clafoutis aux poires vous mettront l'eau à la bouche. D'ailleurs cette dernière ne vous laissera pas en reste. Moelleuse et sucrée sans être écœurante, elle vous rappellera l'eau-de-vie de poire ou encore le Calvados. Ah douce France...",https://vandb.fr/158229/ti-ced-arrange-pomme-poire-bio-21-.html
BEACH HOUSE WHITE 40%,BLANC,SPICED,40.0,MULTIPLES,MAURICE,29.9,0,0,8,4,2,6,0,Transparent,"Frais, pamplemousse, fruits exotiques","Douce, florale, pamplemousse, litchi",0,"Fermez les yeux et imaginez-vous sur une plage de l'océan indien en train de déguster un petit rhum ! Bienvenue sur l'île Maurice, pays d'origine des rhums épicés Beach House. Le territoire mauricien est réputé pour offrir un caractère naturellement épicé et poivré à ses rhums. Idéal pour un spiced !
Pour sa version White, l'idée originale de Beach House a été d'infuser son rhum avec des fruits exotiques comme le litchi, le pamplemousse, et de subtiles épices tropicales. Sa couleur parfaitement transparente est due à une filtration qui intervient avant l'embouteillage. Le résultat est doux et fruité, avec de délicates notes de litchis frais et d'arômes de fruits de la passion agrémentés d'une touche pimentée.",https://vandb.fr/beach-house-white-40-.html
DILLON XO 12 ANS 45%,AMBRÉ,RHUM - TRADITION FRANÇAISE,45.0,DILLON,FRANCE,45.5,2,0,6,0,2,0,8,Reflets dorés,"Vanille, boisé","Chocolat, pruneau, Moka, boisé, Vanille",12,"Dillon est une distillerie installée sur l'île de la Martinique qui produit du rhum agricole depuis 1779. Mais traverser les époques n'est pas aussi simple que ça. Entre crise de l'industrie sucrière, cyclones, explosions, les bâtiments de l'habitation Dillon ont été mis à mal et reconstruit à plusieurs reprises. Malgré cela, le savoir-faire de la maison demeure intact et Dillon produit son rhum agricole en respectant à la lettre la tradition martiniquaise.
Le Dillon XO 12 ans en est un bel exemple. Ce rhum agricole AOC est un pur jus de canne, comme le veut l’appellation, vieilli 12 ans sous le climat tropical de l'île. Ce compte d'âge important offre à ce rhum une belle complexité d'arômes portée par la vanille, le chocolat, ou encore le pruneau. Des notes de moka se développent petit à petit pour une gourmandise maximale.
Un régal pour les papilles !",https://vandb.fr/dillon-xo-12-ans-45-.html
MEZAN JAMAICA XO,AMBRÉ,RUM - TRADITION ANGLAISE,40.0,MULTIPLES,JAMAÏQUE,39.9,6,0,8,4,6,0,0,Paille claire,"Banane fraîche, épices douces, légèrement âcre","Légère, complexe bouquet d'épices, tabac blond, banane",4,"Mezan est ce qu'on appelle un embouteilleur indépendant qui a fait des rhums des Caraïbes sa spécialité. Le maître de chais de la maison parcourt les distilleries de ces îles tropicales pour y dénicher les meilleurs rhums. C'est en Jamaïque qu'il s'est arrêté pour sélectionner dans plusieurs distilleries emblématiques, des rhums allant de 4 à 23 ans. Le maître de chais a ensuite soigneusement assemblé ces rhums afin de mettre en valeur les saveurs tropicales caractéristiques du style jamaïcain. Afin de marier parfaitement les profils de ces cuvées, l'assemblage final est repassé en fût avant d'être embouteillé en un petit lot de 5000 bouteilles.
Mezan Jamaica XO révèle la typicité jamaïcaine tout en légèreté. La banane est présente ainsi qu'un joli bouquet d'épices et de belles notes de tabac blond. De quoi vous donner envie de poursuivre la découverte des rhums de l'île du reggae.",https://vandb.fr/mezan-jamaica-xo.html
GWAÏ MIEL & ÉPICES DE NOËL 32%,AMBRÉ,ARRANGÉS,32.0,AUCUNE,FRANCE,31.0,10,0,8,0,6,6,8,"Ambré, troublé naturellement par le miel","Orange, miel, épices","Ample, onctueuse et chaleureuse.",0,"Quand les courtes journées d'hiver s'installent et que le froid nous gagne, rien de tel que de se retrouver autour d'un bon rhum arrangé pour partager et se réchauffer !
Ce Gwaï miel et épices de Noël vous transporte au beau milieu des marchés de Noël et de leurs gourmandises. On y retrouve le goût des bredele* de Mamie et des pains d’épices de notre tendre enfance...
L'orange, le miel et les épices se révèlent successivement, aussi bien au nez qu'en bouche. La finale est chaude et gourmande.
Ce rhum arrangé est disponible en quantité limitée. Il est évidemment idéal à découvrir ou à offrir durant la période hivernale, mais il pourra s'apprécier également tout au long de l'année.
*Petits gâteaux alsaciens.",https://vandb.fr/gwai-miel-epices-de-noel-32-.html
BEACH HOUSE GOLD 40%,PAILLE,SPICED,40.0,BEACH HOUSE,MAURICE,31.0,4,0,8,4,0,4,6,"Paille, reflets dorés","Équilibré, miel, vanille, orange","Moelleuse, canne à sucre, fleur d'oranger, poivre gris",0,"Direction les plages paradisiaques de l'océan Indien pour faire connaissance avec l'édition Gold de Beach House ! A la base de ce rhum épicé : un rhum tout droit venu de l'île Maurice, destination reconnue pour ses rhums aux saveurs naturellement poivrées et épicées. Il n'en fallait pas moins aux créateurs de Beach House pour ajouter à leur précieuse recette ce rhum mauricien qui se prête parfaitement à l’harmonisation des saveurs.
À la dégustation, douceur et fraîcheur sont de la partie ! Les accents épicés sont là et répondent à des notes d'agrumes, le tout se laissant gentiment adoucir par des tonalités de miel.
Simplicité et inventivité, voilà ce qui caractérise ce spiced rum pas comme les autres !
Facile à boire et abordable, Beach House gold saura satisfaire les jeunes palais comme les plus avisés souhaitant se faire un petit plaisir à un prix raisonnable.",https://vandb.fr/beach-house-gold-40-.html
RELICARIO SUPERIOR 40%,AMBRÉ,RON - TRADITION ESPAGNOLE,40.0,OLIVER & OLIVER,RÉPUBLIQUE DOMINICAINE,45.0,6,0,10,0,6,4,0,Cuivre profond,"Pruneaux, raisins secs, chêne","Doux, bois, vanilles, amandes",0,"C'est la distillerie Oliver & Oliver qui distille les rhums Relicario, comme la plupart des rhums dominicains d'ailleurs !
Contrairement à sa provenance cocotiers et caraïbes, Relicario est tout ce qu'il y a de plus sérieux. La bouteille identitaire, inspirée d'un reliquaire est là pour le prouver. Mais savez-vous pourquoi une telle bouteille ? Elle est inspirée d'une méthode ancestrale qui consistait à fabriquer le rhum, le faire vieillir, l'embouteiller et le faire vieillir dans un reliquaire pendant deux années supplémentaires en bouteille.
Le relicario superior est un pur style ron. Produit selon la méthode solera avec des rons de 5 à 10 ans, le superior arbore des notes de bois, de vanille et de caramel.
Un petit bonbon dans une jolie bouteille !",https://vandb.fr/relicario-superior-40-.html
DILLON XO 7 ANS 45%,AMBRÉ,RHUM - TRADITION FRANÇAISE,45.0,DILLON,FRANCE,39.0,4,0,8,0,6,0,8,Or jaune,"Pruneau, vanille, boisé","Fruits secs, chocolat, café, fin boisé",7,"La distillerie Dillon est une véritable institution sur l'île de la Martinique. Elle doit son nom au Comte Arthur Dillon, qui à la fin du 18ème siècle, combat contre les anglais pour le compte du roi Louis XVI. Ce sont d'ailleurs les couleurs de l'uniforme des troupes du régiment Dillon, jaune et rouge, qui ont inspiré le logo et l'identité des rhums Dillon.
Refermons cette parenthèse historique et retenons l'essentiel. Dillon c'est un savoir-faire unique entretenu depuis 1779 ! Cette édition Dillon XO 7 ans est produite selon la plus pure tradition des rhums agricoles martiniquais. Un pur jus de canne à sucre vieilli en fûts de chêne, qui libère des notes gourmandes de chocolat et de café, parfaitement intégrées, avec un subtil côté boisé.",https://vandb.fr/dillon-xo-7-ans-45-.html
SÉVERIN VSOP 42%,AMBRÉ,RHUM - TRADITION FRANÇAISE,42.0,SÉVERIN,FRANCE,54.0,6,0,8,6,8,0,0,Or,"Caramel, olive verte, poivre, agrumes, réglisse","Iode, caramel, poivre, agrumes",4,"Envolons-nous pour la Guadeloupe afin de découvrir le domaine Séverin. La distillerie Séverin est la plus visitée de l'île ! Le fait qu'elle est ouvert les visites au public en 1986 y est certainement pour quelque chose.
La Maison Séverin possède une belle variété de fûts, en quantité limitée : xérès, bourbon, cognac ou encore bordeaux.
Le chai de vieillissement se situe sur le territoire nord de Basse Terre, où les vents sont réputés pour être moins violents.
Le Séverin VSOP est un rhum vieux agricole qui a vieilli 4 ans en fût ex-bourbon.
Le nez est complexe, il surprend par ses notes de caramel et d'olives vertes, conférant un côté sucré/salée séduisant, auquel s'ajoute des notes d'agrumes et de poivre. La bouche est tout en souplesse et en suavité avec toujours ces notes de caramel salé prédominantes, toujours accompagnées par des saveurs d'agrumes et de poivre. La finale est longue, sur la même trame, avec un retour des notes d'olives vertes.",https://vandb.fr/severin-vsop-42-.html
SÉVERIN XO 45%,AMBRÉ,RHUM - TRADITION FRANÇAISE,45.0,SEVERIN,FRANCE,68.0,8,0,10,0,4,2,4,Ambré,"Vanille, banane cuite, mirabelle.","Puissante, boisée, mirabelle, vanille, épices",6,"Si vous en avez l'opportunité, il ne faut pas manquer la visite de la Maison Séverin qui s'effectue en partie... en petit train ! Une découverte assurément bucolique et gourmande de cette petite distillerie familiale née en 1928. Depuis cette époque, les générations se succèdent mais le savoir-faire perdure.
Séverin XO est un assemblage de rhums de 6 ans d'âge minimum vieillis exclusivement en fûts de bourbon américain.
Cette cuvée hors d'age est assurément complexe et gourmande. Le nez exalte les notes boisées, toastées et pâtissières du bourbon, mais aussi des notes de banane cuite et de mirabelle. La bouche est ronde et puissante, marquée par de belles notes de bois, des épices, de la vanille et une saveur de mirabelle prononcée. La finale est longue et persistante.
Avis aux connaisseurs, Séverin XO ne vous décevra pas !",https://vandb.fr/severin-xo-45-.html
LA MAISON DU RHUM ÎLE MAURICE BATCH 2 43%,AMBRÉ,RHUM - TRADITION FRANÇAISE,43.0,CHAMAREL,MAURICE,64.9,4,0,10,0,6,2,6,Fauve,"Frais, poivre, vanille","Fruits confits, figue, abricot. Finale sur l'amande, la muscade",6,"Fort de son savoir-faire en matière de sélection d'alcools à travers le monde depuis les années 1980, la maison Dugas a lancé sa marque ""La Maison du Rhum"" afin de nous partager ses délicieuses découvertes en mettant en lumière les distilleries, leurs histoires et leurs singularités.
Direction l’île Maurice où les plages paradisiaques cohabitent avec les champs de cannes à sucre... Vous nous suivez ? Ce rhum est l'oeuvre de la maison Chamarel, une jeune distillerie de l'île fondée en 2008 et qui a la spécificité de produit du rhum pur jus à partir de ses propres cannes.
Distillé en 2013, cette cuvée vieillie en fûts de chêne français n'a pas manqué de faire parler d'elle lors de sa sortie.
Le nez balance entre douceur et fraîcheur avec poivrées et vanillées.
La bouche nous amène sur des notes de fruits confis (abricot, figue)
La finale regagne en fraîcheur avec des notes d'épices et d'amande.",https://vandb.fr/la-maison-du-rhum-ile-maurice-batch-2-43-.html
OPTHIMUS 21 ANS 38%,AMBRÉ,RON - TRADITION ESPAGNOLE,38.0,MULTIPLES,RÉPUBLIQUE DOMINICAINE,81.0,0,0,10,0,0,6,6,Acajou,"Noix de coco, orange, café","Chocolatée, sirupeuse, fruitée",21,"Opthimus nous arrive tout droit de Saint-Domingue en République Dominicaine. 60 ans plus tôt, c'est à Cuba qu'il aurait fallu aller le chercher ! C'est en effet sur l'île aux cigares que ce rhum appartenant à la famille Oliver a prospéré durant des dizaines d'années, à partir de 1870 jusqu'à la Revolución de 1959.
Une vingtaine d'années plus tard, après le départ de la famille vers divers horizons, un des cousins Oliver est retourné au bercail. Il mit la main sur des documents expliquant les secrets de l'élaboration du rhum de famille.
Ni une, ni deux, l'activité rhumière reprit du service dès son retour à Saint Domingue où une bonne partie de la famille Oliver avait désormais élu domicile. Le destin ayant bien fait les choses, la République Dominicaine jouit justement d'un terroir tout à fait semblable à celui de Cuba.
De retour dans les bacs, les rons Opthimus sont élevés selon le principe solera dans des fûts ex-bourbon. Ils sont embouteillés et numérotés à la main à un degré plus doux que leurs homologues ron : 38°
Opthimus 21 est un ron résolument gourmand et complexe, avec une multitude d'arômes fruités et pâtissiers qui vont vous faire passer un pur moment de délectation, du début à la fin.",https://vandb.fr/opthimus-21-ans-38-.html
ZACAPA 23 40%,AMBRÉ,RON - TRADITION ESPAGNOLE,40.0,ILG,GUATEMALA,59.9,6,0,10,0,0,4,4,Acajou,"Caramel, épices douces, fruits secs","Miel, fruits secs, caramel",23,"Le saviez-vous ? Zacapa est le nom de la capitale du département éponyme. Eh bien maintenant, vous pouvez briller en société !
Arrêtons la géographie et parlons rhum. Zacapa Solera 23 est rhum guatémaltèque atypique, issu de l'assemblage de rhums de 6 à 23 ans d’âge. Les barriques sont placées à 2 300 mètres d’altitude, au dessus des nuages du Guatemala, pour leur vieillissement.
L’alcool est fondu et une bouche sirupeuse se révèle avec une grande profondeur d’arômes fruités (miel, raisins, abricot sec), boisés et empyreumatiques (chêne, cuir et tabac)
Accessible et facile à boire, ce rhum gourmand s'appréciera en digestif accompagné d’un cigare pour les amateurs.
En parlant cigare, petite astuce : trempez dans votre verre de rhum le bout du cigare pour une dégustation optimale !",https://vandb.fr/zacapa-23-40-.html
TI CED ARRANGÉ LULO LATINO 32%,AMBRÉ,ARRANGÉS,32.0,AUCUNE,FRANCE,34.0,10,0,10,0,8,6,0,"Jaune, jeune or, nuances légèrement brique","Aérien, note d’agrume confit (mandarine), discrète touche de rhubarbe","Attaque nette et puissante, fraîchement acidulée, épices, fruits murs exotiques",0,"Ti Ced nous montre une fois de plus son attrait pour la découverte de nouvelles saveurs à associer avec ses rhums agricoles.
Le Lulo est un fruit jaune originaire d'Amérique centrale. Également appelé la Narangille, il est utilisé dans la fabrication de jus de fruits frais, de gelées, de marmelades ou de sorbets. C'est dans la langue officielle du Pérou, le Quechua, que le Lulo tire son nom. Ce fruit pousse en altitude entre 1200 et 2100 mètres sur des petits arbustes.
Pour mettre en valeur ce fruit exotique, Ti Ced a sélectionné un rhum agricole de Guadeloupe provenant de la plus ancienne distillerie familiale de l'île. Une belle réussite partagée entre notes épicés et arômes de fruits exotiques mûrs.",https://vandb.fr/ti-ced-arrange-lulo-latino-32-.html
TI CED ARRANGÉ BANANE CACAO 32%,AMBRÉ,ARRANGÉS,32.0,AUCUNE,FRANCE,32.0,0,0,10,0,2,6,10,"Acajou, brique, reflets cuivrés","Fève de cacao, banane caramélisée, chocolat noir","Élégante, chocolatée, fruitée",0,"En 2011, Cédric Brément créé la marque Ti Rhum de Ced avec la ferme intention de redorer le blason des rhums arrangés dans le monde des spiritueux. En s'appuyant sur des convictions telles que l'utilisation de fruits frais, de produits 100% naturels, une gamme complète de Ti Arrangés de Ced a vu le jour !
Dans cette version Banane Cacao gourmande et pâtissière, Ti Ced fait appel au savoir-faire français en matière de chocolat. Les fèves de cacao sont importées directement du Mexique et torréfiées à Nantes par un artisan chocolatier local. Une association idéale avec la banane, cultivée et récoltée dans les règles de l'art bien-sûr !",https://vandb.fr/158007/ti-ced-arrange-banane-cacao-32-.html
BUMBU XO 40%,AMBRÉ,RON - TRADITION ESPAGNOLE,40.0,PANAMA,PANAMA,49.9,8,0,6,2,0,6,10,Ambré,"Boisé, caramélisé","Zeste d'orange, épices, café",18,"Bumbu XO est un blend de différentes maturations pouvant atteindre 18 ans. Il est vieilli en fûts de bourbon américain. Un finish en fûts de xérès espagnols apporte du caractère et de la complexité à ce rhum. Distillé et vieilli au Panama dans une distillerie ancestrale de 1890, l’alambic utilisé date de 1912. La canne à sucre est produite localement et soigneusement sélectionnée par le maître distillateur.
Bumbu XO doit son nom à un rhum vieux de 400 ans « Bumbu » fabriqué par des marins et des marchands des Antilles durant le XVIe et le XVIIe siècle. La marque reprend à travers ses rhums cette légende authentique des Caraïbes. Le flacon en verre noir mat ultra-épais orné d’un X en métal et d’une carte des Caraïbes en argent au dos, consolide l'image de ce rhum. La bouteille est couronnée d'un bouchon de liège Bumbu rustique et surdimensionné, s’ouvrant au son d’un « pop » comme aux grandes heures de la piraterie.",https://vandb.fr/bumbu-xo-40-.html
"NEISSON 52,5%",BLANC,RHUM - TRADITION FRANÇAISE,52.5,NEISSON,FRANCE,30.9,6,0,10,8,10,0,0,Cristallin,"Complexe, canne à sucre, fruits, terreux, agrumes, poivre","Fraîche, poivrée, végétale, agrumes",0,"Le Rhum par Neisson va vous réconcilier avec les rhums blancs, car oui un bon rhum blanc peut s'apprécier, même pur.
Celui-ci est fabriqué à partir de cannes à sucre issue du domaine où vents marins les font vaciller et soleil de plomb les font se gorger de sucre. Réalisé sans brûlis et au vert, la coupe permet de révéler toute la richesse de l'environnement sur lequel pousse la canne.
Son autre secret, qui n'en est pas un, c'est la période de maturation durant laquelle le rhum est brassé, aérée, jour après jour, lui conférant petit à petit plus d'équilibre et de fondu. La réduction est également effectuée lentement afin de ne perdre aucun arôme.
Au nez comme en bouche, c'est une explosion fraîche, végétale et fruitée, où la canne prend le temps de s'exprimer. Les notes iodées et épicées du terroir donnent au Rhum par Neisson beaucoup de caractère.
A déguster pur ou en ti'punch ou en planteur.",https://vandb.fr/neisson-52-5-.html
TI CED ARRANGÉ VANILLE MACADAMIA 32%,AMBRÉ,ARRANGÉS,32.0,AUCUNE,FRANCE,38.0,4,0,0,0,0,6,10,"Beige clair, reflet blanc ivoire","Fruits à coques (noix fraîche, noisette), légèrement boisé, vanille","Ample, charpentée. boisée, vanillée, lactée",0,"Toujours en perpétuelle recherche d'innovation pour ses Ti Arrangés, Ced n'a pas peur de se tourner vers d'autres milieux tels que la gastronomie afin trouver de l'inspiration.
Pour revisiter la classique crème glacée Vanille Macadamia en rhum arrangé, Ti Ced s'est appuyé comme à son habitude sur une sélection de produits de qualité. Des gousses de vanille Bourbon de Madagascar, de la noix de Macadamia et du rhum agricole AOC de Martinique macèrent pendant 6 mois dans un fût de Cognac avant d'être embouteillés.
Le résultat est digne des plus belles surprises gastronomiques !",https://vandb.fr/ti-ced-arrange-vanille-macadamia-32-.html
TI CED ARRANGÉ ORANGE CITRON BIO 21%,PAILLE,ARRANGÉS,21.0,AUCUNE,FRANCE,37.0,0,0,10,2,2,6,0,"Jaune orangé, clair, brillant","Frais, fleur d’oranger, zeste de citron","Dense, charnue, agrumes, finale fraîche",0,"Ti Ced étoffe sa gamme en proposant un rhum arrangé 100% BIO. Les oranges et citrons utilisés sont récoltés à la main, au cœur d'une réserve naturelle de la Biosphère (Label UNESCO). Ces endroits sauvages sont idéals pour la culture des agrumes, ils y bénéficient d'un ensoleillement optimal entre mer et montagne ce qui leur confère une saveur unique.
Pour cette version, ce n'est pas le rhum agricole qui a été choisi pour sublimer les agrumes mais un rhum de mélasse 100% biologique. Une alliance réussie pleine de fraîcheur et de parfums.
Un spiritueux français rafraichissant !",https://vandb.fr/ti-ced-arrange-orange-citron-bio-21-.html
